{
  "$schema": "http://json-schema.org/draft-07/schema#",
  "type": "object",
  "properties": {
    "name": {
      "type": "string"
    },
    "type": {
      "anyOf": [
        {
          "type": "string",
          "enum": [
            "component",
            "block",
            "hook",
            "util",
            "config"
          ]
        },
        {
          "type": "string"
        }
      ]
    },
    "dependencies": {
      "type": "object",
      "properties": {
        "npm": {
          "type": "object",
          "propertyNames": {
            "type": "string"
          },
          "additionalProperties": {
            "type": "string"
          }
        },
        "items": {
          "type": "array",
          "items": {
            "type": "string"
          }
        }
      },
      "additionalProperties": false
    },
    "files": {
      "type": "array",
      "items": {
        "type": "object",
        "properties": {
          "name": {
            "type": "string"
          },
          "content": {
            "type": "string"
          },
          "target": {
            "type": "string"
          },
          "path": {
            "type": "string"
          },
          "type": {
            "anyOf": [
              {
                "type": "string",
                "enum": [
                  "component",
                  "block",
                  "hook",
                  "util",
                  "config"
                ]
              },
              {
                "type": "string"
              }
            ]
          }
        },
        "required": [
          "name",
          "target"
        ],
        "additionalProperties": false
      }
    }
  },
  "required": [
    "name",
    "type",
    "files"
  ],
  "additionalProperties": false
}