{
  "name": "alert-dialog",
  "type": "component",
  "dependencies": {
    "items": [
      "button"
    ]
  },
  "files": [
    {
      "name": "alert-dialog.tsx",
      "target": "components",
      "content": "'use client';\r\n\r\nimport { AlertDialog as BaseAlertDialog } from '@base-ui/react/alert-dialog';\r\nimport { buttonVariants } from './button';\r\nimport { cn } from '#utils';\r\n\r\nexport function AlertDialog({\r\n  ...props\r\n}: React.ComponentProps<typeof BaseAlertDialog.Root>) {\r\n  return <BaseAlertDialog.Root data-slot=\"alert-dialog\" {...props} />;\r\n}\r\n\r\nexport function AlertDialogTrigger({\r\n  children,\r\n  ...props\r\n}: React.ComponentProps<typeof BaseAlertDialog.Trigger>) {\r\n  return (\r\n    <BaseAlertDialog.Trigger data-slot=\"alert-dialog-trigger\" {...props}>\r\n      {children}\r\n    </BaseAlertDialog.Trigger>\r\n  );\r\n}\r\n\r\nexport function AlertDialogPopup({\r\n  className,\r\n  children,\r\n  ...props\r\n}: React.ComponentProps<typeof BaseAlertDialog.Popup>) {\r\n  return (\r\n    <BaseAlertDialog.Portal>\r\n      <BaseAlertDialog.Backdrop\r\n        className={cn(\r\n          'fixed inset-0 min-h-dvh bg-black/60 transition-[color,opacity] backdrop-blur-sm',\r\n          'data-[starting-style]:opacity-0 data-[ending-style]:opacity-0',\r\n        )}\r\n      />\r\n      <BaseAlertDialog.Popup\r\n        data-slot=\"alert-dialog-popup\"\r\n        {...props}\r\n        className={cn(\r\n          'fixed left-1/2 -translate-x-1/2 -translate-y-1/2',\r\n          'top-[calc(50%+1.25rem*var(--nested-dialogs))]',\r\n          'bg-dialog text-dialog-foreground backdrop-blur-sm',\r\n          'ring ring-dialog-border rounded-xl shadow',\r\n          'scale-[calc(1-0.1*var(--nested-dialogs))]',\r\n          'outline-none transition-all w-md max-w-[calc(100%-2rem)]',\r\n          'data-[nested-dialog-open]:after:absolute',\r\n          'data-[nested-dialog-open]:after:inset-0',\r\n          'data-[nested-dialog-open]:after:rounded-xl',\r\n          'data-[nested-dialog-open]:after:bg-black/20',\r\n          'data-[nested-dialog-open]:after:z-10',\r\n          'data-[starting-style]:opacity-0 data-[ending-style]:opacity-0',\r\n          'data-[starting-style]:scale-90 data-[ending-style]:scale-90',\r\n          className,\r\n        )}\r\n      >\r\n        {children}\r\n      </BaseAlertDialog.Popup>\r\n    </BaseAlertDialog.Portal>\r\n  );\r\n}\r\n\r\nexport function AlertDialogHeader({\r\n  className,\r\n  children,\r\n  ...props\r\n}: React.ComponentProps<'header'>) {\r\n  return (\r\n    <header\r\n      data-slot=\"alert-dialog-header\"\r\n      {...props}\r\n      className={cn('px-6 pt-4.5 flex items-center gap-3.5', className)}\r\n    >\r\n      {children}\r\n    </header>\r\n  );\r\n}\r\n\r\nexport function AlertDialogTitle({\r\n  className,\r\n  children,\r\n  ...props\r\n}: React.ComponentProps<typeof BaseAlertDialog.Title>) {\r\n  return (\r\n    <BaseAlertDialog.Title\r\n      data-slot=\"alert-dialog-title\"\r\n      {...props}\r\n      className={cn('text-xl font-semibold', className)}\r\n    >\r\n      {children}\r\n    </BaseAlertDialog.Title>\r\n  );\r\n}\r\n\r\nexport function AlertDialogBody({\r\n  className,\r\n  children,\r\n  ...props\r\n}: React.ComponentProps<'div'>) {\r\n  return (\r\n    <div\r\n      data-slot=\"alert-dialog-body\"\r\n      {...props}\r\n      className={cn('px-6 py-4.5', className)}\r\n    >\r\n      {children}\r\n    </div>\r\n  );\r\n}\r\n\r\nexport function AlertDialogDescription({\r\n  className,\r\n  children,\r\n  ...props\r\n}: React.ComponentProps<typeof BaseAlertDialog.Description>) {\r\n  return (\r\n    <BaseAlertDialog.Description\r\n      data-slot=\"alert-dialog-description\"\r\n      {...props}\r\n      className={cn('text-muted leading-relaxed', className)}\r\n    >\r\n      {children}\r\n    </BaseAlertDialog.Description>\r\n  );\r\n}\r\n\r\nexport function AlertDialogFooter({\r\n  className,\r\n  children,\r\n  ...props\r\n}: React.ComponentProps<'footer'>) {\r\n  return (\r\n    <footer\r\n      data-slot=\"alert-dialog-footer\"\r\n      {...props}\r\n      className={cn(\r\n        'flex items-center justify-end gap-1.5',\r\n        'px-6 py-3.5 bg-dialog-footer border-t border-dialog-border rounded-b-xl',\r\n        className,\r\n      )}\r\n    >\r\n      {children}\r\n    </footer>\r\n  );\r\n}\r\n\r\nexport function AlertDialogClose({\r\n  className,\r\n  render,\r\n  children,\r\n  ...props\r\n}: React.ComponentProps<typeof BaseAlertDialog.Close>) {\r\n  return (\r\n    <BaseAlertDialog.Close\r\n      data-slot=\"alert-dialog-close\"\r\n      render={render}\r\n      {...props}\r\n      className={cn(!render && buttonVariants({ variant: 'plain' }), className)}\r\n    >\r\n      {children}\r\n    </BaseAlertDialog.Close>\r\n  );\r\n}\r\n"
    }
  ]
}