{
  "name": "pagination",
  "type": "component",
  "dependencies": {
    "items": [
      "button"
    ]
  },
  "files": [
    {
      "name": "pagination.tsx",
      "target": "components",
      "content": "'use client';\r\n\r\nimport { useRender } from '@base-ui/react/use-render';\r\nimport { buttonVariants } from './button';\r\nimport { cn } from '#utils';\r\n\r\nexport function Pagination({ ...props }: React.ComponentProps<'nav'>) {\r\n  return (\r\n    <nav\r\n      data-slot=\"pagination\"\r\n      aria-label=\"Pagination\"\r\n      {...props}\r\n      className={cn('flex justify-center', props.className)}\r\n    />\r\n  );\r\n}\r\n\r\nexport function PaginationList({\r\n  children,\r\n  ...props\r\n}: React.ComponentProps<'ul'>) {\r\n  return (\r\n    <ul\r\n      data-slot=\"pagination-list\"\r\n      className=\"flex items-center gap-1\"\r\n      {...props}\r\n    >\r\n      {children}\r\n    </ul>\r\n  );\r\n}\r\n\r\nexport function PaginationItem({\r\n  children,\r\n  ...props\r\n}: React.ComponentProps<'li'>) {\r\n  return (\r\n    <li data-slot=\"pagination-item\" {...props}>\r\n      {children}\r\n    </li>\r\n  );\r\n}\r\n\r\nexport function PaginationButton({\r\n  active,\r\n  disabled,\r\n  render,\r\n  ...props\r\n}: useRender.ComponentProps<'button'> & {\r\n  active?: boolean;\r\n  disabled?: boolean;\r\n}) {\r\n  return useRender({\r\n    defaultTagName: 'button',\r\n    render,\r\n    props: {\r\n      'data-slot': 'pagination-button',\r\n      'aria-current': active ? 'page' : undefined,\r\n      'aria-disabled': disabled ? true : undefined,\r\n      className: cn(\r\n        buttonVariants({\r\n          variant: active ? 'secondary' : 'plain',\r\n        }),\r\n        'cursor-pointer',\r\n        active && 'pointer-events-none',\r\n        disabled && 'pointer-events-none opacity-70',\r\n        props.className,\r\n      ),\r\n      ...props,\r\n    },\r\n  });\r\n}\r\n"
    }
  ]
}