{
  "name": "dialog",
  "type": "component",
  "dependencies": {
    "items": [
      "button"
    ]
  },
  "files": [
    {
      "name": "dialog.tsx",
      "target": "components",
      "content": "'use client';\r\n\r\nimport { Dialog as BaseDialog } from '@base-ui/react/dialog';\r\nimport { buttonVariants } from './button';\r\nimport { cn } from '#utils';\r\n\r\nexport function Dialog({\r\n  ...props\r\n}: React.ComponentProps<typeof BaseDialog.Root>) {\r\n  return <BaseDialog.Root data-slot=\"dialog\" {...props} />;\r\n}\r\n\r\nexport function DialogTrigger({\r\n  children,\r\n  ...props\r\n}: React.ComponentProps<typeof BaseDialog.Trigger>) {\r\n  return (\r\n    <BaseDialog.Trigger data-slot=\"dialog-trigger\" {...props}>\r\n      {children}\r\n    </BaseDialog.Trigger>\r\n  );\r\n}\r\n\r\nexport function DialogPopup({\r\n  className,\r\n  children,\r\n  ...props\r\n}: React.ComponentProps<typeof BaseDialog.Popup>) {\r\n  return (\r\n    <BaseDialog.Portal>\r\n      <BaseDialog.Backdrop\r\n        className={cn(\r\n          'fixed inset-0 min-h-dvh bg-black/60 transition-[color,opacity] backdrop-blur-sm',\r\n          'data-[starting-style]:opacity-0 data-[ending-style]:opacity-0',\r\n        )}\r\n      />\r\n      <BaseDialog.Popup\r\n        data-slot=\"dialog-popup\"\r\n        {...props}\r\n        className={cn(\r\n          'fixed left-1/2 -translate-x-1/2 -translate-y-1/2',\r\n          'top-[calc(50%+1.25rem*var(--nested-dialogs))]',\r\n          'bg-dialog text-dialog-foreground backdrop-blur-sm',\r\n          'ring ring-dialog-border rounded-xl shadow',\r\n          'scale-[calc(1-0.1*var(--nested-dialogs))]',\r\n          'outline-none transition-all w-md max-w-[calc(100%-2rem)]',\r\n          'data-[nested-dialog-open]:after:absolute',\r\n          'data-[nested-dialog-open]:after:inset-0',\r\n          'data-[nested-dialog-open]:after:rounded-xl',\r\n          'data-[nested-dialog-open]:after:bg-black/20',\r\n          'data-[nested-dialog-open]:after:z-10',\r\n          'data-[starting-style]:opacity-0 data-[ending-style]:opacity-0',\r\n          'data-[starting-style]:scale-90 data-[ending-style]:scale-90',\r\n          className,\r\n        )}\r\n      >\r\n        {children}\r\n      </BaseDialog.Popup>\r\n    </BaseDialog.Portal>\r\n  );\r\n}\r\n\r\nexport function DialogHeader({\r\n  className,\r\n  children,\r\n  ...props\r\n}: React.ComponentProps<'header'>) {\r\n  return (\r\n    <header\r\n      data-slot=\"dialog-header\"\r\n      {...props}\r\n      className={cn('px-6 pt-4.5 flex items-center gap-3.5', className)}\r\n    >\r\n      {children}\r\n    </header>\r\n  );\r\n}\r\n\r\nexport function DialogTitle({\r\n  className,\r\n  children,\r\n  ...props\r\n}: React.ComponentProps<typeof BaseDialog.Title>) {\r\n  return (\r\n    <BaseDialog.Title\r\n      data-slot=\"dialog-title\"\r\n      {...props}\r\n      className={cn('text-xl font-semibold', className)}\r\n    >\r\n      {children}\r\n    </BaseDialog.Title>\r\n  );\r\n}\r\n\r\nexport function DialogBody({\r\n  className,\r\n  children,\r\n  ...props\r\n}: React.ComponentProps<'div'>) {\r\n  return (\r\n    <div\r\n      data-slot=\"dialog-body\"\r\n      {...props}\r\n      className={cn('px-6 py-4.5 space-y-1.5', className)}\r\n    >\r\n      {children}\r\n    </div>\r\n  );\r\n}\r\n\r\nexport function DialogDescription({\r\n  className,\r\n  children,\r\n  ...props\r\n}: React.ComponentProps<typeof BaseDialog.Description>) {\r\n  return (\r\n    <BaseDialog.Description\r\n      data-slot=\"dialog-description\"\r\n      {...props}\r\n      className={cn('text-muted leading-relaxed', className)}\r\n    >\r\n      {children}\r\n    </BaseDialog.Description>\r\n  );\r\n}\r\n\r\nexport function DialogFooter({\r\n  className,\r\n  children,\r\n  ...props\r\n}: React.ComponentProps<'footer'>) {\r\n  return (\r\n    <footer\r\n      data-slot=\"dialog-footer\"\r\n      {...props}\r\n      className={cn(\r\n        'flex items-center justify-end gap-1.5',\r\n        'px-6 py-3.5 bg-dialog-footer border-t border-dialog-border rounded-b-xl',\r\n        className,\r\n      )}\r\n    >\r\n      {children}\r\n    </footer>\r\n  );\r\n}\r\n\r\nexport function DialogClose({\r\n  className,\r\n  children,\r\n  render,\r\n  ...props\r\n}: React.ComponentProps<typeof BaseDialog.Close>) {\r\n  return (\r\n    <BaseDialog.Close\r\n      data-slot=\"dialog-close\"\r\n      render={render}\r\n      {...props}\r\n      className={cn(!render && buttonVariants({ variant: 'plain' }), className)}\r\n    >\r\n      {children}\r\n    </BaseDialog.Close>\r\n  );\r\n}\r\n"
    }
  ]
}